{
  "contractVersion": 1,
  "id": "prepared.profile.v1",
  "implementation": {
    "revision": "72f900e5a8526e5cee96643a29c48d038376c6c7",
    "package": "@edit-ac/core",
    "version": "0.0.0"
  },
  "versions": {
    "semanticSchema": "editac.registry.editor.v5",
    "updateSync": "editac.yrs-yjs.editor.v5",
    "updateEncoding": 1,
    "extensionDescriptor": 1,
    "publicApi": 1,
    "nativeAbi": 1,
    "sourceDialect": "editac.internal"
  },
  "platform": "portable",
  "resources": {
    "qualified": false,
    "limits": {
      "bytes": 16777216,
      "sources": 4096,
      "operations": 4096,
      "spans": 8192,
      "textBytes": 1048576,
      "sourceUtf16": 262144,
      "depth": 128,
      "jsonDepth": 32,
      "cutBytes": 256,
      "controls": 8192,
      "hierarchyDepth": 128,
      "registrations": 4096,
      "edgeVisits": 16777216,
      "idBytes": 96,
      "anyValues": 262144,
      "structs": 262144,
      "containerEntries": 8192,
      "allocationClock": 2097152
    },
    "evidence": []
  },
  "capabilities": [
    {
      "id": "editor.read",
      "state": {
        "available": true,
        "enabled": true,
        "authorized": null,
        "qualified": true
      },
      "permissions": [],
      "evidence": [
        "prepared.read"
      ]
    },
    {
      "id": "editor.write",
      "state": {
        "available": true,
        "enabled": false,
        "authorized": null,
        "qualified": false
      },
      "permissions": [
        "document.write"
      ],
      "evidence": []
    }
  ],
  "converters": [
    {
      "from": "editac.internal",
      "to": "markdown.source",
      "direction": "export",
      "fidelity": "source-preserving",
      "capability": "editor.read",
      "evidence": [
        "prepared.read"
      ],
      "version": 1
    }
  ],
  "inputs": [
    {
      "path": "fixtures/schema-v5/profile.json",
      "sha256": "d0a68db300d2953de29ff8208a4d1208d6ec13cba0544cbf7302ee24acd6b5f9"
    },
    {
      "path": "packages/core/package.json",
      "sha256": "bd197a60ce165ba168269508ee82e081090dd04c0d80b6078e8584e25e6fdc62"
    },
    {
      "path": "crates/editac-ffi/src/lib.rs",
      "sha256": "a3c71871cad4e78731aaadc74074a01cf8864885abbb8dacc087928bd7cbcecc"
    },
    {
      "path": "packages/core/src/extensions/profiles.ts",
      "sha256": "c4c43ea26ca859ddf916300dda981e1a48f3eaa214703c6029222bbfe7321520"
    },
    {
      "path": "packages/core/src/extensions/registry.ts",
      "sha256": "f07db2fe6b4be34cb0c77fe27ee8fcc86064650805a99e905e1541ead474a5dd"
    }
  ],
  "evidence": [
    {
      "id": "prepared.read",
      "path": "tests/architecture/profiles/fixtures/prepared-proof.json",
      "sha256": "e06019723a2689604134e3a9649c72d4585aaf3c06b2868a9f08aecd3b0a311d",
      "revision": "e06019723a2689604134e3a9649c72d4585aaf3c06b2868a9f08aecd3b0a311d",
      "implementationRevision": "72f900e5a8526e5cee96643a29c48d038376c6c7",
      "scopes": [
        "editor.read"
      ],
      "provenance": "prepared"
    }
  ]
}
